{"schemaVersion":1,"lang":"en","model":"fixture","version":"1.1.0","entries":{"integument":{"name":"Integumentary system","status":"unreviewed","origin":"source","source":"Fixture"},"integument.skin":{"name":"Skin","status":"unreviewed","origin":"source","source":"Fixture"},"integument.skin_of_trunk":{"name":"Skin of trunk","status":"unreviewed","origin":"source","source":"Fixture"},"integument.skin_of_head":{"name":"Skin of head","status":"unreviewed","origin":"source","source":"Fixture"},"skeletal":{"name":"Skeletal system","status":"unreviewed","origin":"source","source":"Fixture"},"skeletal.skull":{"name":"Skull","status":"unreviewed","origin":"source","source":"Fixture"},"skeletal.vertebral_column":{"name":"Vertebral column","status":"unreviewed","origin":"source","source":"Fixture"},"skeletal.sternum":{"name":"Sternum","status":"unreviewed","origin":"source","source":"Fixture"},"skeletal.humerus_l":{"name":"Humerus","status":"unreviewed","origin":"source","source":"Fixture"},"skeletal.humerus_r":{"name":"Humerus","status":"unreviewed","origin":"source","source":"Fixture"},"skeletal.femur_l":{"name":"Femur","status":"unreviewed","origin":"source","source":"Fixture"},"skeletal.femur_r":{"name":"Femur","status":"unreviewed","origin":"source","source":"Fixture"},"skeletal.calcaneus_l":{"name":"Calcaneus","status":"unreviewed","origin":"source","source":"Fixture"},"skeletal.calcaneus_r":{"name":"Calcaneus","status":"unreviewed","origin":"source","source":"Fixture"},"cardiovascular":{"name":"Cardiovascular system","status":"unreviewed","origin":"source","source":"Fixture"},"cardiovascular.heart":{"name":"Heart","status":"unreviewed","origin":"source","source":"Fixture","synonyms":["Cardiac muscle organ"]},"cardiovascular.heart.left_ventricle":{"name":"Left ventricle","status":"unreviewed","origin":"source","source":"Fixture","synonyms":["LV"]},"cardiovascular.heart.right_ventricle":{"name":"Right ventricle","status":"unreviewed","origin":"source","source":"Fixture","synonyms":["RV"]},"cardiovascular.heart.valves":{"name":"Valves of heart","status":"unreviewed","origin":"source","source":"Fixture"},"cardiovascular.aorta":{"name":"Aorta","status":"unreviewed","origin":"source","source":"Fixture"},"respiratory":{"name":"Respiratory system","status":"unreviewed","origin":"source","source":"Fixture"},"respiratory.lung_l":{"name":"Left lung","status":"unreviewed","origin":"source","source":"Fixture"},"respiratory.lung_l.upper_part":{"name":"Upper part of left lung (alternative decomposition)","status":"unreviewed","origin":"source","source":"Fixture"},"respiratory.lung_r":{"name":"Right lung","status":"unreviewed","origin":"source","source":"Fixture"},"nervous":{"name":"Nervous system","status":"unreviewed","origin":"source","source":"Fixture"},"nervous.brain":{"name":"Brain","status":"unreviewed","origin":"source","source":"Fixture"},"nervous.cortex":{"name":"Cerebral cortex","status":"unreviewed","origin":"source","source":"Fixture"},"cardiovascular.pulmonary_trunk":{"name":"Pulmonary trunk","status":"unreviewed","origin":"source","source":"Fixture"}},"missing":[]}
