{"schemaVersion":1,"lang":"la","model":"fixture","version":"1.0.0","entries":{"integument":{"name":"Integumentum commune","status":"unreviewed","origin":"source","source":"Fixture"},"integument.skin":{"name":"Cutis","status":"unreviewed","origin":"source","source":"Fixture"},"integument.skin_of_trunk":{"name":"Cutis trunci","status":"unreviewed","origin":"source","source":"Fixture"},"integument.skin_of_head":{"name":"Cutis capitis","status":"unreviewed","origin":"source","source":"Fixture"},"skeletal":{"name":"Systema skeletale","status":"unreviewed","origin":"source","source":"Fixture"},"skeletal.skull":{"name":"Cranium","status":"unreviewed","origin":"source","source":"Fixture"},"skeletal.vertebral_column":{"name":"Columna vertebralis","status":"unreviewed","origin":"source","source":"Fixture"},"skeletal.sternum":{"name":"Sternum","status":"unreviewed","origin":"source","source":"Fixture"},"skeletal.humerus_l":{"name":"Humerus","status":"unreviewed","origin":"source","source":"Fixture"},"skeletal.humerus_r":{"name":"Humerus","status":"unreviewed","origin":"source","source":"Fixture"},"skeletal.femur_l":{"name":"Femur","status":"unreviewed","origin":"source","source":"Fixture"},"skeletal.femur_r":{"name":"Femur","status":"unreviewed","origin":"source","source":"Fixture"},"skeletal.calcaneus_l":{"name":"Calcaneus","status":"unreviewed","origin":"source","source":"Fixture"},"skeletal.calcaneus_r":{"name":"Calcaneus","status":"unreviewed","origin":"source","source":"Fixture"},"cardiovascular":{"name":"Systema cardiovasculare","status":"unreviewed","origin":"source","source":"Fixture"},"cardiovascular.heart":{"name":"Cor","status":"unreviewed","origin":"source","source":"Fixture"},"cardiovascular.heart.left_ventricle":{"name":"Ventriculus sinister","status":"unreviewed","origin":"source","source":"Fixture"},"cardiovascular.heart.right_ventricle":{"name":"Ventriculus dexter","status":"unreviewed","origin":"source","source":"Fixture"},"cardiovascular.heart.valves":{"name":"Valvae cordis","status":"unreviewed","origin":"source","source":"Fixture"},"cardiovascular.aorta":{"name":"Aorta","status":"unreviewed","origin":"source","source":"Fixture"},"respiratory":{"name":"Systema respiratorium","status":"unreviewed","origin":"source","source":"Fixture"},"respiratory.lung_l":{"name":"Pulmo sinister","status":"unreviewed","origin":"source","source":"Fixture"},"respiratory.lung_r":{"name":"Pulmo dexter","status":"unreviewed","origin":"source","source":"Fixture"},"nervous":{"name":"Systema nervosum","status":"unreviewed","origin":"source","source":"Fixture"},"nervous.brain":{"name":"Encephalon","status":"unreviewed","origin":"source","source":"Fixture"},"nervous.cortex":{"name":"Cortex cerebri","status":"unreviewed","origin":"source","source":"Fixture"}},"missing":["respiratory.lung_l.upper_part"]}
