{"schemaVersion":1,"lang":"uk","model":"fixture","version":"1.1.0","entries":{"integument":{"name":"Покривна система","status":"reviewed","origin":"editorial","source":"Fixture","review":{"status":"reviewed","reviewer":"Fixture reviewer","date":"2026-09-25","scope":"Synthetic test fixture only"}},"integument.skin":{"name":"Шкіра","status":"reviewed","origin":"editorial","source":"Fixture","review":{"status":"reviewed","reviewer":"Fixture reviewer","date":"2026-09-25","scope":"Synthetic test fixture only"}},"integument.skin_of_trunk":{"name":"Шкіра тулуба","status":"unreviewed","origin":"draft","source":"Fixture"},"skeletal":{"name":"Скелетна система","status":"reviewed","origin":"editorial","source":"Fixture","review":{"status":"reviewed","reviewer":"Fixture reviewer","date":"2026-09-25","scope":"Synthetic test fixture only"}},"skeletal.skull":{"name":"Череп","status":"reviewed","origin":"editorial","source":"Fixture","review":{"status":"reviewed","reviewer":"Fixture reviewer","date":"2026-09-25","scope":"Synthetic test fixture only"}},"skeletal.vertebral_column":{"name":"Хребтовий стовп","status":"unreviewed","origin":"draft","source":"Fixture"},"skeletal.sternum":{"name":"Груднина","status":"reviewed","origin":"editorial","source":"Fixture","review":{"status":"reviewed","reviewer":"Fixture reviewer","date":"2026-09-25","scope":"Synthetic test fixture only"}},"skeletal.humerus_l":{"name":"Плечова кістка","status":"reviewed","origin":"editorial","source":"Fixture","review":{"status":"reviewed","reviewer":"Fixture reviewer","date":"2026-09-25","scope":"Synthetic test fixture only"}},"skeletal.humerus_r":{"name":"Плечова кістка","status":"reviewed","origin":"editorial","source":"Fixture","review":{"status":"reviewed","reviewer":"Fixture reviewer","date":"2026-09-25","scope":"Synthetic test fixture only"}},"skeletal.femur_l":{"name":"Стегнова кістка","status":"unreviewed","origin":"draft","source":"Fixture"},"skeletal.femur_r":{"name":"Стегнова кістка","status":"unreviewed","origin":"draft","source":"Fixture"},"cardiovascular":{"name":"Серцево-судинна система","status":"reviewed","origin":"editorial","source":"Fixture","review":{"status":"reviewed","reviewer":"Fixture reviewer","date":"2026-09-25","scope":"Synthetic test fixture only"}},"cardiovascular.heart":{"name":"Серце","status":"reviewed","origin":"editorial","source":"Fixture","review":{"status":"reviewed","reviewer":"Fixture reviewer","date":"2026-09-25","scope":"Synthetic test fixture only"}},"cardiovascular.heart.left_ventricle":{"name":"Лівий шлуночок","status":"reviewed","origin":"editorial","source":"Fixture","review":{"status":"reviewed","reviewer":"Fixture reviewer","date":"2026-09-25","scope":"Synthetic test fixture only"},"synonyms":["ЛШ"]},"cardiovascular.heart.right_ventricle":{"name":"Правий шлуночок","status":"unreviewed","origin":"draft","source":"Fixture"},"cardiovascular.aorta":{"name":"Аорта","status":"reviewed","origin":"editorial","source":"Fixture","review":{"status":"reviewed","reviewer":"Fixture reviewer","date":"2026-09-25","scope":"Synthetic test fixture only"}},"respiratory":{"name":"Дихальна система","status":"reviewed","origin":"editorial","source":"Fixture","review":{"status":"reviewed","reviewer":"Fixture reviewer","date":"2026-09-25","scope":"Synthetic test fixture only"}},"respiratory.lung_l":{"name":"Ліва легеня","status":"reviewed","origin":"editorial","source":"Fixture","review":{"status":"reviewed","reviewer":"Fixture reviewer","date":"2026-09-25","scope":"Synthetic test fixture only"}},"respiratory.lung_r":{"name":"Права легеня","status":"reviewed","origin":"editorial","source":"Fixture","review":{"status":"reviewed","reviewer":"Fixture reviewer","date":"2026-09-25","scope":"Synthetic test fixture only"}},"nervous":{"name":"Нервова система","status":"reviewed","origin":"editorial","source":"Fixture","review":{"status":"reviewed","reviewer":"Fixture reviewer","date":"2026-09-25","scope":"Synthetic test fixture only"}},"nervous.brain":{"name":"Головний мозок","status":"reviewed","origin":"editorial","source":"Fixture","review":{"status":"reviewed","reviewer":"Fixture reviewer","date":"2026-09-25","scope":"Synthetic test fixture only"}}},"missing":["integument.skin_of_head","skeletal.calcaneus_l","skeletal.calcaneus_r","cardiovascular.heart.valves","respiratory.lung_l.upper_part","nervous.cortex","cardiovascular.pulmonary_trunk"]}
